client_id	path	sentence	up_votes	down_votes	age	gender	accent	locale	segment
7f0318d63b289f2e6283c01d99431f92159e4808efb47441ba76e234a46f60df1d078248b41e041c1209ec2aca763921220f77c29e00b68dd070145cca161284	common_voice_ru_20521108.mp3	Вронский вошел в середину партера и, остановившись, стал оглядываться.	1	2				ru	
7f0318d63b289f2e6283c01d99431f92159e4808efb47441ba76e234a46f60df1d078248b41e041c1209ec2aca763921220f77c29e00b68dd070145cca161284	common_voice_ru_20521106.mp3	Если она не сможет этого сделать, необходимо будет принять какие-то другие конкретные меры.	1	2				ru	
7f0318d63b289f2e6283c01d99431f92159e4808efb47441ba76e234a46f60df1d078248b41e041c1209ec2aca763921220f77c29e00b68dd070145cca161284	common_voice_ru_20521107.mp3	Фру-Фру была среднего роста лошадь и по статям небезукоризненная.	0	2				ru	
7f0318d63b289f2e6283c01d99431f92159e4808efb47441ba76e234a46f60df1d078248b41e041c1209ec2aca763921220f77c29e00b68dd070145cca161284	common_voice_ru_20521109.mp3	Полученное же письмо будет считаться как не бывшее вовсе.	0	2				ru	
7f0318d63b289f2e6283c01d99431f92159e4808efb47441ba76e234a46f60df1d078248b41e041c1209ec2aca763921220f77c29e00b68dd070145cca161284	common_voice_ru_20521110.mp3	Это чрезвычайно сложная проблема, которую необходимо рассматривать и изучать.	0	2				ru	
719c2767dd12983694cd8bf3683304acb55473f9acbdb6e88b8f1ba00ee0020889d66718c907214edb71b1cebe0753d120ee64c8f2b2b0b78ab62ca705ea32b6	common_voice_ru_20524649.mp3	Княгиня пригласила Марью Евгеньевну с дочерью и полковника.	1	2	fourties	male		ru	
b7518e7666a10c26e1406669cfda71da042d3446d89dbf376f806f5e34aec758744aba44e1805a065508406b832b4538c1ee4c4ea74e332d2cd3107375c62a5e	common_voice_ru_20524873.mp3	Не имея еще предмета для ревности, она отыскивала его.	0	2	sixties	male		ru	
b7518e7666a10c26e1406669cfda71da042d3446d89dbf376f806f5e34aec758744aba44e1805a065508406b832b4538c1ee4c4ea74e332d2cd3107375c62a5e	common_voice_ru_20524911.mp3	Левин вернулся после своего четырехмесячного путешествия совершенно другим человеком.	1	2	sixties	male		ru	
75d4af05d6b064eee11e60cd477bbe30ed3642cc31b10559f675c54bfb476384f9bb7a9cb2f3eccf54133608b8b282d76693d2cac98a32206a8ca1852ff67b02	common_voice_ru_20526679.mp3	Шагах в двухстах вправо оканчивался третий пруд парка.	0	2	twenties	male		ru	
75d4af05d6b064eee11e60cd477bbe30ed3642cc31b10559f675c54bfb476384f9bb7a9cb2f3eccf54133608b8b282d76693d2cac98a32206a8ca1852ff67b02	common_voice_ru_20526685.mp3	Кити еще была ребенок, когда Левин вышел из университета.	0	2	twenties	male		ru	
a1432cf5e5cd02eef20e01780aa5c8761b20623c07a1cd25f76151bdda0051c4e66329012e3b3ace4cd48f267de0ef2195fa8aa1ea071fb51042e4b09f9faf22	common_voice_ru_20526871.mp3	Варенька покачала головой и положила свою руку на руку Кити.	1	2				ru	
a1432cf5e5cd02eef20e01780aa5c8761b20623c07a1cd25f76151bdda0051c4e66329012e3b3ace4cd48f267de0ef2195fa8aa1ea071fb51042e4b09f9faf22	common_voice_ru_20526916.mp3	И он хотел уйти, но теперь она задержала его.	1	2				ru	
e86bd981d8e68473ac672311ae213e1f431a59b05f62fa4af9b567e668563a092321a761857514bda0ef0470aead3e4a097709d49fb72f5c09d8e49934f7a4bf	common_voice_ru_20528306.mp3	Никто этому верить не хотел, а так вышло.	1	2	twenties	male		ru	
24a3bb3d89d479dad3d8f30e1643c00b3943cb08f1b1e5a74c7b2c2bebe7ac104f9fc37f641461130bbf18759b0feb7cd123f5c29b1fabacd4ebdec3744532a8	common_voice_ru_20528381.mp3	И, мрачно пропустив мимо себя Каренина, он затворил дверь.	1	2	teens	male		ru	
4b4651ad099b14e85ee4b9ca000c6335852eede83ffafd65da4029f24e38c7856dce44192534d73d455522d518d1b29a92dead5d7411c5e9bfe1f2a1146bbdb0	common_voice_ru_20529539.mp3	Ее основополагающее значение обусловлено ее универсальным характером, ее легитимностью и ее механизмами решения проблем.	0	2				ru	
4b4651ad099b14e85ee4b9ca000c6335852eede83ffafd65da4029f24e38c7856dce44192534d73d455522d518d1b29a92dead5d7411c5e9bfe1f2a1146bbdb0	common_voice_ru_20529541.mp3	Давайте же преисполнимся решимости добиться перемен к лучшему уже сегодня.	0	2				ru	
4b4651ad099b14e85ee4b9ca000c6335852eede83ffafd65da4029f24e38c7856dce44192534d73d455522d518d1b29a92dead5d7411c5e9bfe1f2a1146bbdb0	common_voice_ru_20529542.mp3	Не стоит извиняться, и потом у нас впереди еще китайский Новый год.	0	2				ru	
3458647480e2d65aa70f9f08a15d09c4fb60ca5c1ab66224d4aecd1c9d6599edf213b6f945465774e896e2842a3f281b038f34614ffe545435d8adf198fa6793	common_voice_ru_20531787.mp3	Такое действие было бы серьезным нарушением и ущемлением суверенитета Кении.	1	2				ru	
9e3e7f2f71433d4b7c7a1489ff74e45ccd6669c535a13d617ac907136580cc3a090ac239e823be5f36eba74145e5f70cbf089b5b2d4e06579d47b90bdb3bad6c	common_voice_ru_20532462.mp3	Два мальчика в тени ракиты ловили удочками рыбу.	0	2				ru	
9e3e7f2f71433d4b7c7a1489ff74e45ccd6669c535a13d617ac907136580cc3a090ac239e823be5f36eba74145e5f70cbf089b5b2d4e06579d47b90bdb3bad6c	common_voice_ru_20532464.mp3	Я хотел бы поддержать предложение, которое Вы, господин Председатель, выдвинули.	1	2				ru	
9e3e7f2f71433d4b7c7a1489ff74e45ccd6669c535a13d617ac907136580cc3a090ac239e823be5f36eba74145e5f70cbf089b5b2d4e06579d47b90bdb3bad6c	common_voice_ru_20532466.mp3	Но даже при таких успехах, мы не считаем себя совершенными.	0	2				ru	
719c2767dd12983694cd8bf3683304acb55473f9acbdb6e88b8f1ba00ee0020889d66718c907214edb71b1cebe0753d120ee64c8f2b2b0b78ab62ca705ea32b6	common_voice_ru_20534622.mp3	На следующей станции Катавасов и исполнил этот совет.	0	2	fourties	male		ru	
719c2767dd12983694cd8bf3683304acb55473f9acbdb6e88b8f1ba00ee0020889d66718c907214edb71b1cebe0753d120ee64c8f2b2b0b78ab62ca705ea32b6	common_voice_ru_20534659.mp3	Шатов мгновенным, едва скользнувшим взглядом посмотрел на нее, но тотчас же опустил глаза.	0	2	fourties	male		ru	
719c2767dd12983694cd8bf3683304acb55473f9acbdb6e88b8f1ba00ee0020889d66718c907214edb71b1cebe0753d120ee64c8f2b2b0b78ab62ca705ea32b6	common_voice_ru_20535177.mp3	Не нужно рассказывать молодежи о ее потребностях или о том, как удовлетворять их.	0	2	fourties	male		ru	
89c8bc456c9632704a0f319ece858b53cb4f29e9568b2da0485847c457c992f43c8646e5f3db9dbacb6119159698ca4aff9319ce2f94c5047284c75d844de1a2	common_voice_ru_20535558.mp3	Однако они также обсуждались многие годы без какого-либо реального прогресса.	0	2	fourties	male		ru	
89c8bc456c9632704a0f319ece858b53cb4f29e9568b2da0485847c457c992f43c8646e5f3db9dbacb6119159698ca4aff9319ce2f94c5047284c75d844de1a2	common_voice_ru_20535562.mp3	Нам надо разблокировать и открыть площадку и начать прокладывать путь в русле ядерного разоружения.	1	2	fourties	male		ru	
719c2767dd12983694cd8bf3683304acb55473f9acbdb6e88b8f1ba00ee0020889d66718c907214edb71b1cebe0753d120ee64c8f2b2b0b78ab62ca705ea32b6	common_voice_ru_20536349.mp3	Пока тупик продолжается, можно и нужно достичь согласия в отношении продвижения других соответствующих вопросов.	0	2	fourties	male		ru	
0fa580af768d2da79724f1bcf758d531cf7bde1135cadb002d130caebdf93e01f92a9f71face1e1bdb245f24f388e7840e87071acbcc5850e95c8138d7d95ef3	common_voice_ru_20541361.mp3	Не будь этой интервенции, прежнее ливийское правительство оставалось бы у власти.	1	2	fourties	male		ru	
719c2767dd12983694cd8bf3683304acb55473f9acbdb6e88b8f1ba00ee0020889d66718c907214edb71b1cebe0753d120ee64c8f2b2b0b78ab62ca705ea32b6	common_voice_ru_20545918.mp3	Пока мы здесь выступаем, молодые люди наших наций преобразуют нашу безопасность и процветание.	1	2	fourties	male		ru	
719c2767dd12983694cd8bf3683304acb55473f9acbdb6e88b8f1ba00ee0020889d66718c907214edb71b1cebe0753d120ee64c8f2b2b0b78ab62ca705ea32b6	common_voice_ru_20545985.mp3	Поэтому мы разочарованы тем, что резолюцию по столь важному вопросу пришлось принимать путем голосования.	0	2	fourties	male		ru	
719c2767dd12983694cd8bf3683304acb55473f9acbdb6e88b8f1ba00ee0020889d66718c907214edb71b1cebe0753d120ee64c8f2b2b0b78ab62ca705ea32b6	common_voice_ru_20546091.mp3	Поэтому нам крайне важно вынести проект конституции на общенациональный референдум.	0	2	fourties	male		ru	
6363650590c73eefd42340ec2868f3ccfcbaeeeb731a4cfbb7b87d2236651547a57671f7184f9e4c60587291e3d4ab3fbe4ee1560e75d01f49f607877a02c51e	common_voice_ru_20546459.mp3	Этот Год теперь подходит к концу, но мы знаем, что задачи остаются.	0	2				ru	
6363650590c73eefd42340ec2868f3ccfcbaeeeb731a4cfbb7b87d2236651547a57671f7184f9e4c60587291e3d4ab3fbe4ee1560e75d01f49f607877a02c51e	common_voice_ru_20546609.mp3	Она сняла шляпку и, нравственно засучив рукава, приготовилась действовать.	0	2				ru	
9ba2a17dedd7d3f666bdae2344585dc042bfa2a7f2e27b5f56b0e00bf2685493c5520d3614aed28322337fb25debf4dd5406cddcdc602fc483c0ba6b14357126	common_voice_ru_20548276.mp3	Дверь отворилась, и швейцар с пледом на руку подозвал карету.	0	2	twenties	male		ru	
527a8af009462c264e077b9081abbf758846312bcc7cda12db88e48225cf8c11e2cf83f9a563923c4924279cdb93a919ed98b664596684bafc3a641d683a04af	common_voice_ru_20548797.mp3	Злонамеренная политика Израиля многообразна и сурово сказывается на положении всех слоев и групп населения.	1	2		male		ru	
527a8af009462c264e077b9081abbf758846312bcc7cda12db88e48225cf8c11e2cf83f9a563923c4924279cdb93a919ed98b664596684bafc3a641d683a04af	common_voice_ru_20548805.mp3	Вы, впрочем, не любите заграничной жизни, — сказала она, ласково улыбаясь.	1	2		male		ru	
527a8af009462c264e077b9081abbf758846312bcc7cda12db88e48225cf8c11e2cf83f9a563923c4924279cdb93a919ed98b664596684bafc3a641d683a04af	common_voice_ru_20548858.mp3	Ведь это будет ужасно и для меня и для нее.	0	2		male		ru	
527a8af009462c264e077b9081abbf758846312bcc7cda12db88e48225cf8c11e2cf83f9a563923c4924279cdb93a919ed98b664596684bafc3a641d683a04af	common_voice_ru_20548878.mp3	Весловский, желая видеть стрельбу, заехал в болото и увязил лошадей.	1	2		male		ru	
eb550be65b28c3a33854efb07fd5d923e1f681c3fb4f11dbe430cb0b0a43deeb4f2ef931a3e692f4130e6ec8e9a5613b70cb8da43b0c2f79a5d6987954aa3835	common_voice_ru_20549035.mp3	По крайней мере, насколько я понимаю, какого-то консенсуса, необходимого для ее изменения, нет.	0	2				ru	
eb550be65b28c3a33854efb07fd5d923e1f681c3fb4f11dbe430cb0b0a43deeb4f2ef931a3e692f4130e6ec8e9a5613b70cb8da43b0c2f79a5d6987954aa3835	common_voice_ru_20549039.mp3	Хромой до того озлился, что даже перестал отвечать.	0	2				ru	
eb550be65b28c3a33854efb07fd5d923e1f681c3fb4f11dbe430cb0b0a43deeb4f2ef931a3e692f4130e6ec8e9a5613b70cb8da43b0c2f79a5d6987954aa3835	common_voice_ru_20549050.mp3	Белиз выражает безоговорочную приверженность поддержке этой инициативы.	0	2				ru	
eb550be65b28c3a33854efb07fd5d923e1f681c3fb4f11dbe430cb0b0a43deeb4f2ef931a3e692f4130e6ec8e9a5613b70cb8da43b0c2f79a5d6987954aa3835	common_voice_ru_20549052.mp3	Жду, что вот они явятся из леса, и всё решится.	0	2				ru	
eb550be65b28c3a33854efb07fd5d923e1f681c3fb4f11dbe430cb0b0a43deeb4f2ef931a3e692f4130e6ec8e9a5613b70cb8da43b0c2f79a5d6987954aa3835	common_voice_ru_20549053.mp3	Лиза улыбнулась мне, но была бледна.	1	2				ru	
8b2f6e48a3a0cce407cfd0248a6b5f463415d1d80f1022fcc9a2648f5d468774e973f650822e543169bf37a6bb2ffb4430b89ed31331c363b7ca03de10cb2c5b	common_voice_ru_20554246.mp3	А теперь слово имеет представитель Германии посол Хоффман.	0	2	twenties	male		ru	
8b2f6e48a3a0cce407cfd0248a6b5f463415d1d80f1022fcc9a2648f5d468774e973f650822e543169bf37a6bb2ffb4430b89ed31331c363b7ca03de10cb2c5b	common_voice_ru_20554243.mp3	Бангладеш является решительным сторонником многостороннего подхода к разоружению и нераспространению.	1	2	twenties	male		ru	
8b2f6e48a3a0cce407cfd0248a6b5f463415d1d80f1022fcc9a2648f5d468774e973f650822e543169bf37a6bb2ffb4430b89ed31331c363b7ca03de10cb2c5b	common_voice_ru_20554245.mp3	Участие — это не просто один из выборов, это — требование молодежи.	0	2	twenties	male		ru	
719c2767dd12983694cd8bf3683304acb55473f9acbdb6e88b8f1ba00ee0020889d66718c907214edb71b1cebe0753d120ee64c8f2b2b0b78ab62ca705ea32b6	common_voice_ru_20554415.mp3	Были и такие, что подняли и опять взяли назад.	0	2	fourties	male		ru	
0a5f3287731c4c856605027e1a9412f5121a784c3e0fc2fc57c0bf40b33b65eddab4815b43af0d1ef1c39c94fea01bbab4c0b4d49060407de1e4b0dc62fa9092	common_voice_ru_20558245.mp3	Китай как жертва крайне озабочен сложившейся ситуацией.	1	2				ru	
0a5f3287731c4c856605027e1a9412f5121a784c3e0fc2fc57c0bf40b33b65eddab4815b43af0d1ef1c39c94fea01bbab4c0b4d49060407de1e4b0dc62fa9092	common_voice_ru_20558244.mp3	Только в крайнем случае я обращусь к вам.	0	2				ru	
0a5f3287731c4c856605027e1a9412f5121a784c3e0fc2fc57c0bf40b33b65eddab4815b43af0d1ef1c39c94fea01bbab4c0b4d49060407de1e4b0dc62fa9092	common_voice_ru_20558247.mp3	Нам важно развивать эту интеграцию.	0	2				ru	
0a5f3287731c4c856605027e1a9412f5121a784c3e0fc2fc57c0bf40b33b65eddab4815b43af0d1ef1c39c94fea01bbab4c0b4d49060407de1e4b0dc62fa9092	common_voice_ru_20558246.mp3	Он с отвращением вспомнил свои мечты женитьбы на крестьянке.	0	2				ru	
0a5f3287731c4c856605027e1a9412f5121a784c3e0fc2fc57c0bf40b33b65eddab4815b43af0d1ef1c39c94fea01bbab4c0b4d49060407de1e4b0dc62fa9092	common_voice_ru_20558243.mp3	Многим статья эта недоступна, то есть выше их.	0	2				ru	
719c2767dd12983694cd8bf3683304acb55473f9acbdb6e88b8f1ba00ee0020889d66718c907214edb71b1cebe0753d120ee64c8f2b2b0b78ab62ca705ea32b6	common_voice_ru_20561154.mp3	Мы должны руководствоваться этой основополагающей верой, — в ответственность государств и в права всех людей.	1	2	fourties	male		ru	
ff3d3ebf1900a69387afd075011737171de619f234840539f45f1e5b38e20d5a71b634c5e1baceaaab214f73acfc1039713fb0887791eac349d0abbde009675d	common_voice_ru_20571982.mp3	Это в дополнение к открытию клиник для здоровых людей и ранней диагностики.	1	2				ru	
ff3d3ebf1900a69387afd075011737171de619f234840539f45f1e5b38e20d5a71b634c5e1baceaaab214f73acfc1039713fb0887791eac349d0abbde009675d	common_voice_ru_20571986.mp3	Да, а теперь и лечите, возите к себе этих шарлатанов.	0	2				ru	
719c2767dd12983694cd8bf3683304acb55473f9acbdb6e88b8f1ba00ee0020889d66718c907214edb71b1cebe0753d120ee64c8f2b2b0b78ab62ca705ea32b6	common_voice_ru_20579399.mp3	В совокупности все это создает фундамент новой фазы Сандинистской революции.	1	2	fourties	male		ru	
15c47ba661472d7a1608036a916e57f23bf83b11bd1a7e9018868db16c368fad7d479caf0e9f0a66eabeb4d2364e0742f3546d016fd5014be01972d7dcd556e5	common_voice_ru_20582764.mp3	Мы, разумеется, рассчитываем на сотрудничество с вами.	0	2				ru	
719c2767dd12983694cd8bf3683304acb55473f9acbdb6e88b8f1ba00ee0020889d66718c907214edb71b1cebe0753d120ee64c8f2b2b0b78ab62ca705ea32b6	common_voice_ru_20583694.mp3	Наше Движение готово всегда и везде обеспечивать необходимые поддержку и сотрудничество в этом деле.	0	2	fourties	male		ru	
24a3bb3d89d479dad3d8f30e1643c00b3943cb08f1b1e5a74c7b2c2bebe7ac104f9fc37f641461130bbf18759b0feb7cd123f5c29b1fabacd4ebdec3744532a8	common_voice_ru_20584085.mp3	И здесь, в Нью-Йорке, также можно многое сделать в поддержку таких действий.	1	2	teens	male		ru	
24a3bb3d89d479dad3d8f30e1643c00b3943cb08f1b1e5a74c7b2c2bebe7ac104f9fc37f641461130bbf18759b0feb7cd123f5c29b1fabacd4ebdec3744532a8	common_voice_ru_20584100.mp3	Мы подчеркиваем нашу поддержку для следующего Председателя Конференции — Эфиопии.	1	2	teens	male		ru	
a6745acb2330e0c1f19a90f815b32c513de6f30fc5d8624004b6e829008e396d9b14ceddfeea318ffa282a0b5afbefc98e43f490acb602dbdebe8544171fad8f	common_voice_ru_20584222.mp3	Она это высказала так же брезгливо, как и все прежние капризные свои фразы.	0	2				ru	
a6745acb2330e0c1f19a90f815b32c513de6f30fc5d8624004b6e829008e396d9b14ceddfeea318ffa282a0b5afbefc98e43f490acb602dbdebe8544171fad8f	common_voice_ru_20584220.mp3	Институт не рассчитывает на полное финансирование из регулярного бюджета Организации Объединенных Наций.	0	2				ru	
a6745acb2330e0c1f19a90f815b32c513de6f30fc5d8624004b6e829008e396d9b14ceddfeea318ffa282a0b5afbefc98e43f490acb602dbdebe8544171fad8f	common_voice_ru_20584223.mp3	Приступаем ко второму голосованию.	0	2				ru	
a6745acb2330e0c1f19a90f815b32c513de6f30fc5d8624004b6e829008e396d9b14ceddfeea318ffa282a0b5afbefc98e43f490acb602dbdebe8544171fad8f	common_voice_ru_20584221.mp3	Мы должны найти способ защитить сирийский народ через осуществление принципа обязанности по защите.	0	2				ru	
e50dd55487723c8f903a20757a3359a6b073fd4791e27710e2fc0c095aafee9ec4c53067d46fc8d3898cad221e432afada0563c9d8209756dd9605cd12cc28fe	common_voice_ru_20602079.mp3	Поэтому все мы должны направлять наши усилия на достижение всеобщего и полного разоружения.	0	2				ru	
5aba37aa1214cafb6dd1c7fce2c462b3f6b6ada0b25e9a63760211330ff9ba332bd7f7d2a8b2b41641dd9b004499bd92b41dda468e652b56d700019515d00d43	common_voice_ru_20611963.mp3	Вы, впрочем, не любите заграничной жизни, — сказала она, ласково улыбаясь.	1	2				ru	
5aba37aa1214cafb6dd1c7fce2c462b3f6b6ada0b25e9a63760211330ff9ba332bd7f7d2a8b2b41641dd9b004499bd92b41dda468e652b56d700019515d00d43	common_voice_ru_20611965.mp3	Благодарю посла Кеннеди за ее заявление.	1	2				ru	
e05e29944bcaf4c41456f247de98e8cedd0935279886d2915e355e36e2d8405dcee573881def4479fa97b6bc62dfae331f871c644312bc3338f896ec03f9eab8	common_voice_ru_20622829.mp3	И как раз в этом контексте Конференция и имеет особую роль и ответственность.	0	2	teens	male		ru	
e05e29944bcaf4c41456f247de98e8cedd0935279886d2915e355e36e2d8405dcee573881def4479fa97b6bc62dfae331f871c644312bc3338f896ec03f9eab8	common_voice_ru_20622834.mp3	Теперь непонятно, куда её девать.	0	2	teens	male		ru	
e05e29944bcaf4c41456f247de98e8cedd0935279886d2915e355e36e2d8405dcee573881def4479fa97b6bc62dfae331f871c644312bc3338f896ec03f9eab8	common_voice_ru_20623018.mp3	Этот документ отражает консенсус, которого мы достигли в прошлом году.	0	2	teens	male		ru	
e05e29944bcaf4c41456f247de98e8cedd0935279886d2915e355e36e2d8405dcee573881def4479fa97b6bc62dfae331f871c644312bc3338f896ec03f9eab8	common_voice_ru_20623097.mp3	Я заверяю его в полной поддержке и сотрудничестве со стороны моей делегации.	0	2	teens	male		ru	
e05e29944bcaf4c41456f247de98e8cedd0935279886d2915e355e36e2d8405dcee573881def4479fa97b6bc62dfae331f871c644312bc3338f896ec03f9eab8	common_voice_ru_20623234.mp3	Мы хотим ускорить процесс преобразования Индии в партнерстве с международным сообществом.	0	2	teens	male		ru	
e05e29944bcaf4c41456f247de98e8cedd0935279886d2915e355e36e2d8405dcee573881def4479fa97b6bc62dfae331f871c644312bc3338f896ec03f9eab8	common_voice_ru_20623273.mp3	Благодарю посла Алжира и предоставляю слово господину Орджоникидзе.	1	2	teens	male		ru	
719c2767dd12983694cd8bf3683304acb55473f9acbdb6e88b8f1ba00ee0020889d66718c907214edb71b1cebe0753d120ee64c8f2b2b0b78ab62ca705ea32b6	common_voice_ru_20632744.mp3	Мы расцениваем разоружение и контроль над вооружениями в качестве ключевых элементов глобальной архитектуры безопасности.	0	2	fourties	male		ru	
de40b010787c86d318e751aa290abf0d426231b00af4ebc8f0d5a703437cf45329151ee2c242962b3a568fccf631c280a13a55baa45cfeea530369cfb1578355	common_voice_ru_20634181.mp3	Это было должным образом отмечено Генеральным секретарем в его докладе.	1	2				ru	
719c2767dd12983694cd8bf3683304acb55473f9acbdb6e88b8f1ba00ee0020889d66718c907214edb71b1cebe0753d120ee64c8f2b2b0b78ab62ca705ea32b6	common_voice_ru_20636353.mp3	Женя вскочила, откинула волосы, одернула помятый сарафанчик	0	2	fourties	male		ru	
9a9378073cd9917d4963da7d740d470b6b02d5100686b6be345348c2acde0b2cff714511672e191374fed5cc9a95d74f1b9f1a95d1bcb5d16215a6d169b3fa87	common_voice_ru_20652293.mp3	Это был машинист, про которого совсем забыл Левин.	0	2				ru	
719c2767dd12983694cd8bf3683304acb55473f9acbdb6e88b8f1ba00ee0020889d66718c907214edb71b1cebe0753d120ee64c8f2b2b0b78ab62ca705ea32b6	common_voice_ru_20656262.mp3	Кроме того, происходят глобальные изменения, которые требуют координированных ответных мер.	1	2	fourties	male		ru	
a90b34c57d25ec60fa947ae751705020b6543998f722fb257c44d4c9cbe195124da771d6f70fdfdecc23d44adcdf406da560e38a9666804218867b4f43229bd0	common_voice_ru_20656896.mp3	Мы убеждены, что гендерное неравенство и социальная несправедливость являются движущими силами эпидемии.	1	2	teens	male		ru	
719c2767dd12983694cd8bf3683304acb55473f9acbdb6e88b8f1ba00ee0020889d66718c907214edb71b1cebe0753d120ee64c8f2b2b0b78ab62ca705ea32b6	common_voice_ru_20691759.mp3	Страны Северной Европы уже активно поддерживают этот процесс с помощью финансовых и других средств.	0	2	fourties	male		ru	
719c2767dd12983694cd8bf3683304acb55473f9acbdb6e88b8f1ba00ee0020889d66718c907214edb71b1cebe0753d120ee64c8f2b2b0b78ab62ca705ea32b6	common_voice_ru_20691762.mp3	Пользуясь случаем, хотел бы вновь изложить некоторые основные пункты подхода Молдовы к этой проблеме.	1	2	fourties	male		ru	
719c2767dd12983694cd8bf3683304acb55473f9acbdb6e88b8f1ba00ee0020889d66718c907214edb71b1cebe0753d120ee64c8f2b2b0b78ab62ca705ea32b6	common_voice_ru_20691760.mp3	Иран на протяжении многих десятилетий находится на переднем крае полномасштабной войны с контрабандой наркотиков.	0	2	fourties	male		ru	
719c2767dd12983694cd8bf3683304acb55473f9acbdb6e88b8f1ba00ee0020889d66718c907214edb71b1cebe0753d120ee64c8f2b2b0b78ab62ca705ea32b6	common_voice_ru_20691763.mp3	В этом году в проект резолюции внесены новые противоречивые элементы.	0	2	fourties	male		ru	
