client_id	path	sentence	up_votes	down_votes	age	gender	accent	locale	segment
e8fa3f83083bdee9d15a7cbf06392bea487b14ab13bf3b8a018765a1519a03db3fe35f21ed6cbf025f96db936710f70abc7889dac6481aa8350335e0caaaeb0f	common_voice_ru_18925535.mp3	К такому выводу пришли исследователи из Высшей школы экономики.	0	2	twenties	male		ru	
e8fa3f83083bdee9d15a7cbf06392bea487b14ab13bf3b8a018765a1519a03db3fe35f21ed6cbf025f96db936710f70abc7889dac6481aa8350335e0caaaeb0f	common_voice_ru_18925574.mp3	Ядерное разоружение и международные стратегические условия безопасности неотделимы друг от друга.	0	2	twenties	male		ru	
e8fa3f83083bdee9d15a7cbf06392bea487b14ab13bf3b8a018765a1519a03db3fe35f21ed6cbf025f96db936710f70abc7889dac6481aa8350335e0caaaeb0f	common_voice_ru_18925613.mp3	До Иркутска она была доставлена на специальном самолете.	1	2	twenties	male		ru	
e8fa3f83083bdee9d15a7cbf06392bea487b14ab13bf3b8a018765a1519a03db3fe35f21ed6cbf025f96db936710f70abc7889dac6481aa8350335e0caaaeb0f	common_voice_ru_18925638.mp3	Стройно подходили голубые отряды ручных и колесных мороженщиков.	1	2	twenties	male		ru	
e8fa3f83083bdee9d15a7cbf06392bea487b14ab13bf3b8a018765a1519a03db3fe35f21ed6cbf025f96db936710f70abc7889dac6481aa8350335e0caaaeb0f	common_voice_ru_18925641.mp3	Все это необычно и во многом впервые.	0	2	twenties	male		ru	
e5b9b88d0fb767e7af97416c4b93c1540a24229c7817e946b579db5019ee8c88e03092ee2e361ee4b9ec1bc2f43712298e5d5494404efd08ad0b09499da90290	common_voice_ru_18925889.mp3	И это лишь немногие из затрагивавшихся проблем.	0	2	fifties	female		ru	
e5b9b88d0fb767e7af97416c4b93c1540a24229c7817e946b579db5019ee8c88e03092ee2e361ee4b9ec1bc2f43712298e5d5494404efd08ad0b09499da90290	common_voice_ru_18926021.mp3	В этой связи я хотела бы отметить призыв, озвученный представителями Доминиканской Республики и Турции.	1	2	fifties	female		ru	
e5b9b88d0fb767e7af97416c4b93c1540a24229c7817e946b579db5019ee8c88e03092ee2e361ee4b9ec1bc2f43712298e5d5494404efd08ad0b09499da90290	common_voice_ru_18926183.mp3	Куба принимала активное участие в этом процессе и представила значительное число поправок к тексту.	0	2	fifties	female		ru	
e5b9b88d0fb767e7af97416c4b93c1540a24229c7817e946b579db5019ee8c88e03092ee2e361ee4b9ec1bc2f43712298e5d5494404efd08ad0b09499da90290	common_voice_ru_18926383.mp3	И смотрю, какая последняя цифра страницы; допустим, семерка.	0	2	fifties	female		ru	
8a127fc948673d60d84fe655fe2065747e0f45e96a5150470517a71b4e44b29ca53460963a85dd976c691fd1a25a17ad70e601d68c4542bfc7403ced29f7574f	common_voice_ru_18926722.mp3	Помощь в этом деле ему будет оказывать заместитель Специального посланника Насер аль-Кидва.	1	2	twenties	female		ru	
8a127fc948673d60d84fe655fe2065747e0f45e96a5150470517a71b4e44b29ca53460963a85dd976c691fd1a25a17ad70e601d68c4542bfc7403ced29f7574f	common_voice_ru_18926758.mp3	Я знаю по личному опыту, каких успехов может добиться Генеральная Ассамблея.	1	2	twenties	female		ru	
8a127fc948673d60d84fe655fe2065747e0f45e96a5150470517a71b4e44b29ca53460963a85dd976c691fd1a25a17ad70e601d68c4542bfc7403ced29f7574f	common_voice_ru_18926866.mp3	Транспарентность в вооружениях не должна ограничивать право государства на приобретение оружия для целей самообороны.	0	2	twenties	female		ru	
8a127fc948673d60d84fe655fe2065747e0f45e96a5150470517a71b4e44b29ca53460963a85dd976c691fd1a25a17ad70e601d68c4542bfc7403ced29f7574f	common_voice_ru_18926885.mp3	Я вас сюда не звала.	0	2	twenties	female		ru	
8a127fc948673d60d84fe655fe2065747e0f45e96a5150470517a71b4e44b29ca53460963a85dd976c691fd1a25a17ad70e601d68c4542bfc7403ced29f7574f	common_voice_ru_18926883.mp3	Нет и указаний на то, что целью этих нападений была Организация Объединенных Наций.	0	2	twenties	female		ru	
8a127fc948673d60d84fe655fe2065747e0f45e96a5150470517a71b4e44b29ca53460963a85dd976c691fd1a25a17ad70e601d68c4542bfc7403ced29f7574f	common_voice_ru_18926886.mp3	По своей сути мандат носит политический, а не технический характер.	0	2	twenties	female		ru	
8a127fc948673d60d84fe655fe2065747e0f45e96a5150470517a71b4e44b29ca53460963a85dd976c691fd1a25a17ad70e601d68c4542bfc7403ced29f7574f	common_voice_ru_18926977.mp3	Попробуй обращаться с животным ласково.	0	2	twenties	female		ru	
8a127fc948673d60d84fe655fe2065747e0f45e96a5150470517a71b4e44b29ca53460963a85dd976c691fd1a25a17ad70e601d68c4542bfc7403ced29f7574f	common_voice_ru_18926955.mp3	Проблемы, затрагивающие страны Сахельского региона, сложны и вызваны многими коренными причинами.	0	2	twenties	female		ru	
8a127fc948673d60d84fe655fe2065747e0f45e96a5150470517a71b4e44b29ca53460963a85dd976c691fd1a25a17ad70e601d68c4542bfc7403ced29f7574f	common_voice_ru_18926980.mp3	Создание экономических возможностей для сомалийского народа — это вопрос, который необходимо решать в срочном порядке.	1	2	twenties	female		ru	
8213a0f79acb074bf5427027efa90e01391d8709700f103d434a0831e9232e7c83551fff5f5e2bf4e65128b0432eeec7292ecbfaa0c624ea2b3d38450e844c22	common_voice_ru_18927205.mp3	Такой обзор никоим образом не означает негативных последствий для организационной структуры Совета.	0	2	twenties	female		ru	
8213a0f79acb074bf5427027efa90e01391d8709700f103d434a0831e9232e7c83551fff5f5e2bf4e65128b0432eeec7292ecbfaa0c624ea2b3d38450e844c22	common_voice_ru_18927215.mp3	Я просил бы вас сообщить мне, есть ли такое желание.	0	2	twenties	female		ru	
8213a0f79acb074bf5427027efa90e01391d8709700f103d434a0831e9232e7c83551fff5f5e2bf4e65128b0432eeec7292ecbfaa0c624ea2b3d38450e844c22	common_voice_ru_18927232.mp3	Потому что у нас информации не было по изобразительному искусству никакой.	0	2	twenties	female		ru	
8213a0f79acb074bf5427027efa90e01391d8709700f103d434a0831e9232e7c83551fff5f5e2bf4e65128b0432eeec7292ecbfaa0c624ea2b3d38450e844c22	common_voice_ru_18927277.mp3	Ни одно из государств-членов не получило того, чего добивалось.	0	2	twenties	female		ru	
8213a0f79acb074bf5427027efa90e01391d8709700f103d434a0831e9232e7c83551fff5f5e2bf4e65128b0432eeec7292ecbfaa0c624ea2b3d38450e844c22	common_voice_ru_18927314.mp3	– Ответ на письмо давайте, – твердо сказал Гейка.	0	2	twenties	female		ru	
069a52e11463c9ab123cb2dc71b33027c7ac775040a89298a851f022af36204b74f031611007aa1a052dbecfb34cb66ebd6402f79158fd9b335f71cb67f197bd	common_voice_ru_18927395.mp3	Любая система должна работать эффективно не вопреки, а благодаря заложенным в нее принципам.	0	2	twenties	male		ru	
069a52e11463c9ab123cb2dc71b33027c7ac775040a89298a851f022af36204b74f031611007aa1a052dbecfb34cb66ebd6402f79158fd9b335f71cb67f197bd	common_voice_ru_18927394.mp3	Мы поехали на дачу жарить шашлыки.	1	2	twenties	male		ru	
8213a0f79acb074bf5427027efa90e01391d8709700f103d434a0831e9232e7c83551fff5f5e2bf4e65128b0432eeec7292ecbfaa0c624ea2b3d38450e844c22	common_voice_ru_18927403.mp3	В пещере сидел медведь.	0	2	twenties	female		ru	
8213a0f79acb074bf5427027efa90e01391d8709700f103d434a0831e9232e7c83551fff5f5e2bf4e65128b0432eeec7292ecbfaa0c624ea2b3d38450e844c22	common_voice_ru_18927450.mp3	Я выбрал профессию, которой я всегда хотел заниматься.	1	2	twenties	female		ru	
8213a0f79acb074bf5427027efa90e01391d8709700f103d434a0831e9232e7c83551fff5f5e2bf4e65128b0432eeec7292ecbfaa0c624ea2b3d38450e844c22	common_voice_ru_18927455.mp3	Колбочки отвечают за цветное, а палочки - за сумеречное зрение.	1	2	twenties	female		ru	
8213a0f79acb074bf5427027efa90e01391d8709700f103d434a0831e9232e7c83551fff5f5e2bf4e65128b0432eeec7292ecbfaa0c624ea2b3d38450e844c22	common_voice_ru_18927502.mp3	По мере выполнения ими этих задач Соединенные Штаты будут и впредь оказывать им поддержку.	0	2	twenties	female		ru	
8213a0f79acb074bf5427027efa90e01391d8709700f103d434a0831e9232e7c83551fff5f5e2bf4e65128b0432eeec7292ecbfaa0c624ea2b3d38450e844c22	common_voice_ru_18927512.mp3	Турция приветствует проведение этой конференции и полностью поддерживает ее коммюнике.	1	2	twenties	female		ru	
8213a0f79acb074bf5427027efa90e01391d8709700f103d434a0831e9232e7c83551fff5f5e2bf4e65128b0432eeec7292ecbfaa0c624ea2b3d38450e844c22	common_voice_ru_18927551.mp3	– Не ходи, – дергая за руку Гейку, прошептал Коля.	0	2	twenties	female		ru	
8213a0f79acb074bf5427027efa90e01391d8709700f103d434a0831e9232e7c83551fff5f5e2bf4e65128b0432eeec7292ecbfaa0c624ea2b3d38450e844c22	common_voice_ru_18927578.mp3	Двадцать четыре миллиарда двести шестнадцать миллионов двести девятнадцать тысяч пятьсот сорок пять.	0	2	twenties	female		ru	
8213a0f79acb074bf5427027efa90e01391d8709700f103d434a0831e9232e7c83551fff5f5e2bf4e65128b0432eeec7292ecbfaa0c624ea2b3d38450e844c22	common_voice_ru_18927598.mp3	И никогда не будет мира на Ближнем Востоке без урегулирования израильско-палестинского конфликта.	0	2	twenties	female		ru	
8213a0f79acb074bf5427027efa90e01391d8709700f103d434a0831e9232e7c83551fff5f5e2bf4e65128b0432eeec7292ecbfaa0c624ea2b3d38450e844c22	common_voice_ru_18927749.mp3	Поощряются добровольное социальное страхование, создание дополнительных форм социального обеспечения и благотворительность.	0	2	twenties	female		ru	
8213a0f79acb074bf5427027efa90e01391d8709700f103d434a0831e9232e7c83551fff5f5e2bf4e65128b0432eeec7292ecbfaa0c624ea2b3d38450e844c22	common_voice_ru_18927782.mp3	Он менее всего совестился своих лохмотьев на улице.	0	2	twenties	female		ru	
8213a0f79acb074bf5427027efa90e01391d8709700f103d434a0831e9232e7c83551fff5f5e2bf4e65128b0432eeec7292ecbfaa0c624ea2b3d38450e844c22	common_voice_ru_18927828.mp3	Стоящие перед нами задачи включают осуществление «Гароуэсского процесса» в очень сжатые сроки.	0	2	twenties	female		ru	
8213a0f79acb074bf5427027efa90e01391d8709700f103d434a0831e9232e7c83551fff5f5e2bf4e65128b0432eeec7292ecbfaa0c624ea2b3d38450e844c22	common_voice_ru_18927879.mp3	Вчера в Бенгази на улицы вышли миллион человек.	1	2	twenties	female		ru	
8213a0f79acb074bf5427027efa90e01391d8709700f103d434a0831e9232e7c83551fff5f5e2bf4e65128b0432eeec7292ecbfaa0c624ea2b3d38450e844c22	common_voice_ru_18927881.mp3	Сейчас я предоставлю слово членам Совета Безопасности.	1	2	twenties	female		ru	
8a127fc948673d60d84fe655fe2065747e0f45e96a5150470517a71b4e44b29ca53460963a85dd976c691fd1a25a17ad70e601d68c4542bfc7403ced29f7574f	common_voice_ru_18927896.mp3	Бриджтаун является столицей Барбадоса.	1	2	twenties	female		ru	
8a127fc948673d60d84fe655fe2065747e0f45e96a5150470517a71b4e44b29ca53460963a85dd976c691fd1a25a17ad70e601d68c4542bfc7403ced29f7574f	common_voice_ru_18927894.mp3	В этой связи важно, чтобы поведение развернутых в стране военнослужащих было безупречным.	1	2	twenties	female		ru	
8a127fc948673d60d84fe655fe2065747e0f45e96a5150470517a71b4e44b29ca53460963a85dd976c691fd1a25a17ad70e601d68c4542bfc7403ced29f7574f	common_voice_ru_18927979.mp3	Кроме того, по тому же вопросу слова просили Китай и Канада.	0	2	twenties	female		ru	
8a127fc948673d60d84fe655fe2065747e0f45e96a5150470517a71b4e44b29ca53460963a85dd976c691fd1a25a17ad70e601d68c4542bfc7403ced29f7574f	common_voice_ru_18927990.mp3	Склонялся к тому, что нам надо радикально менять политическую систему.	0	2	twenties	female		ru	
8a127fc948673d60d84fe655fe2065747e0f45e96a5150470517a71b4e44b29ca53460963a85dd976c691fd1a25a17ad70e601d68c4542bfc7403ced29f7574f	common_voice_ru_18928002.mp3	Каждый модуль также снабжен светодиодами, которые позволяют «показывать» ночью дорожную разметку.	0	2	twenties	female		ru	
8a127fc948673d60d84fe655fe2065747e0f45e96a5150470517a71b4e44b29ca53460963a85dd976c691fd1a25a17ad70e601d68c4542bfc7403ced29f7574f	common_voice_ru_18928053.mp3	Это были процессы, во главе которых стояли народные массы.	1	2	twenties	female		ru	
8a127fc948673d60d84fe655fe2065747e0f45e96a5150470517a71b4e44b29ca53460963a85dd976c691fd1a25a17ad70e601d68c4542bfc7403ced29f7574f	common_voice_ru_18928081.mp3	А как это связано с алгоритмом?	0	2	twenties	female		ru	
8a127fc948673d60d84fe655fe2065747e0f45e96a5150470517a71b4e44b29ca53460963a85dd976c691fd1a25a17ad70e601d68c4542bfc7403ced29f7574f	common_voice_ru_18928092.mp3	Хорошо бы так сняться и потом притащить в школу карточку!	0	2	twenties	female		ru	
8a127fc948673d60d84fe655fe2065747e0f45e96a5150470517a71b4e44b29ca53460963a85dd976c691fd1a25a17ad70e601d68c4542bfc7403ced29f7574f	common_voice_ru_18928100.mp3	Я возвращаюсь к исполнению своих обязанностей Председателя Совета.	1	2	twenties	female		ru	
a68f7a8322ae676ad8256e2928e72816acf1105a03f8aff3d282e6f404ec37016ebecf7642ce3b1d1dfe468b2cc23da847f0bbd220782f328c7c4cb0bd6ed630	common_voice_ru_18928129.mp3	Этому насилию необходимо положить конец, и сделать это надо немедленно.	0	2	thirties	male		ru	
a68f7a8322ae676ad8256e2928e72816acf1105a03f8aff3d282e6f404ec37016ebecf7642ce3b1d1dfe468b2cc23da847f0bbd220782f328c7c4cb0bd6ed630	common_voice_ru_18928131.mp3	– Такой, знаешь ли, странный случай, такое необычайное приключение!	0	2	thirties	male		ru	
a68f7a8322ae676ad8256e2928e72816acf1105a03f8aff3d282e6f404ec37016ebecf7642ce3b1d1dfe468b2cc23da847f0bbd220782f328c7c4cb0bd6ed630	common_voice_ru_18928126.mp3	Вас зовут Михаил Квакин.	1	2	thirties	male		ru	
8a127fc948673d60d84fe655fe2065747e0f45e96a5150470517a71b4e44b29ca53460963a85dd976c691fd1a25a17ad70e601d68c4542bfc7403ced29f7574f	common_voice_ru_18928149.mp3	Эти две проблемы имеют центральное значение для определения природы договора, предусматриваемого государствами-членами.	0	2	twenties	female		ru	
8a127fc948673d60d84fe655fe2065747e0f45e96a5150470517a71b4e44b29ca53460963a85dd976c691fd1a25a17ad70e601d68c4542bfc7403ced29f7574f	common_voice_ru_18928181.mp3	Такое определение поможет заинтересованным сторонам оказывать необходимые услуги лицам, ставшим жертвами сексуального насилия.	0	2	twenties	female		ru	
8a127fc948673d60d84fe655fe2065747e0f45e96a5150470517a71b4e44b29ca53460963a85dd976c691fd1a25a17ad70e601d68c4542bfc7403ced29f7574f	common_voice_ru_18928188.mp3	И сделал опрометчивый шаг.	1	2	twenties	female		ru	
8a127fc948673d60d84fe655fe2065747e0f45e96a5150470517a71b4e44b29ca53460963a85dd976c691fd1a25a17ad70e601d68c4542bfc7403ced29f7574f	common_voice_ru_18928177.mp3	В наших общих интересах начать работу по четырем пунктам повестки дня Конференции.	1	2	twenties	female		ru	
8a127fc948673d60d84fe655fe2065747e0f45e96a5150470517a71b4e44b29ca53460963a85dd976c691fd1a25a17ad70e601d68c4542bfc7403ced29f7574f	common_voice_ru_18928209.mp3	С другой стороны, мы должны стремиться к созданию благоприятных условий за рамками Конференции.	1	2	twenties	female		ru	
8a127fc948673d60d84fe655fe2065747e0f45e96a5150470517a71b4e44b29ca53460963a85dd976c691fd1a25a17ad70e601d68c4542bfc7403ced29f7574f	common_voice_ru_18928243.mp3	Но эти вопросы вовсе не являются неразрешимыми.	1	2	twenties	female		ru	
e8fa3f83083bdee9d15a7cbf06392bea487b14ab13bf3b8a018765a1519a03db3fe35f21ed6cbf025f96db936710f70abc7889dac6481aa8350335e0caaaeb0f	common_voice_ru_18928306.mp3	Слова просил уважаемый делегат Корейской Народно-Демократической Республики.	1	2	twenties	male		ru	
e8fa3f83083bdee9d15a7cbf06392bea487b14ab13bf3b8a018765a1519a03db3fe35f21ed6cbf025f96db936710f70abc7889dac6481aa8350335e0caaaeb0f	common_voice_ru_18928324.mp3	Надо еще и подгонять, подбирать параметры какой-то исходной теории.	0	2	twenties	male		ru	
8a127fc948673d60d84fe655fe2065747e0f45e96a5150470517a71b4e44b29ca53460963a85dd976c691fd1a25a17ad70e601d68c4542bfc7403ced29f7574f	common_voice_ru_18928340.mp3	Сегодняшние прения представляются очень своевременными.	1	2	twenties	female		ru	
8a127fc948673d60d84fe655fe2065747e0f45e96a5150470517a71b4e44b29ca53460963a85dd976c691fd1a25a17ad70e601d68c4542bfc7403ced29f7574f	common_voice_ru_18928343.mp3	Мы очень признательны всем присутствующим, представляющим правительства и гражданское общество.	0	2	twenties	female		ru	
e8fa3f83083bdee9d15a7cbf06392bea487b14ab13bf3b8a018765a1519a03db3fe35f21ed6cbf025f96db936710f70abc7889dac6481aa8350335e0caaaeb0f	common_voice_ru_18928556.mp3	Кроме того, в число авторов проекта резолюции вошли Сальвадор и Боливарианская Республика Венесуэла.	0	2	twenties	male		ru	
e8fa3f83083bdee9d15a7cbf06392bea487b14ab13bf3b8a018765a1519a03db3fe35f21ed6cbf025f96db936710f70abc7889dac6481aa8350335e0caaaeb0f	common_voice_ru_18928563.mp3	Что ты все там бормочешь, выдумываешь, не даешь спокойно умыться!	0	2	twenties	male		ru	
e8fa3f83083bdee9d15a7cbf06392bea487b14ab13bf3b8a018765a1519a03db3fe35f21ed6cbf025f96db936710f70abc7889dac6481aa8350335e0caaaeb0f	common_voice_ru_18928641.mp3	В прошлом Соединенное Королевство производило высокообогащенный уран и плутоний оружейного назначения.	0	2	twenties	male		ru	
e8fa3f83083bdee9d15a7cbf06392bea487b14ab13bf3b8a018765a1519a03db3fe35f21ed6cbf025f96db936710f70abc7889dac6481aa8350335e0caaaeb0f	common_voice_ru_18928685.mp3	Да вы и сами, господин Председатель, касались этого в своем вводном слове.	1	2	twenties	male		ru	
e8fa3f83083bdee9d15a7cbf06392bea487b14ab13bf3b8a018765a1519a03db3fe35f21ed6cbf025f96db936710f70abc7889dac6481aa8350335e0caaaeb0f	common_voice_ru_18928703.mp3	Мы хотели бы заверить его в нашей полной его поддержке на этом посту.	0	2	twenties	male		ru	
e8fa3f83083bdee9d15a7cbf06392bea487b14ab13bf3b8a018765a1519a03db3fe35f21ed6cbf025f96db936710f70abc7889dac6481aa8350335e0caaaeb0f	common_voice_ru_18928716.mp3	Снятие этих трех характеристик, дает нам представление о живой социологии.	1	2	twenties	male		ru	
e8fa3f83083bdee9d15a7cbf06392bea487b14ab13bf3b8a018765a1519a03db3fe35f21ed6cbf025f96db936710f70abc7889dac6481aa8350335e0caaaeb0f	common_voice_ru_18928714.mp3	Для ее полного искоренения требуется всеобъемлющая стратегия, направленная на устранение первопричин.	1	2	twenties	male		ru	
e8fa3f83083bdee9d15a7cbf06392bea487b14ab13bf3b8a018765a1519a03db3fe35f21ed6cbf025f96db936710f70abc7889dac6481aa8350335e0caaaeb0f	common_voice_ru_18928723.mp3	Ползут в тиши враги.	0	2	twenties	male		ru	
e8fa3f83083bdee9d15a7cbf06392bea487b14ab13bf3b8a018765a1519a03db3fe35f21ed6cbf025f96db936710f70abc7889dac6481aa8350335e0caaaeb0f	common_voice_ru_18928798.mp3	Мы также полагаем, что процесс национального примирения должен возглавляться и осуществляться самим Афганистаном.	1	2	twenties	male		ru	
e8fa3f83083bdee9d15a7cbf06392bea487b14ab13bf3b8a018765a1519a03db3fe35f21ed6cbf025f96db936710f70abc7889dac6481aa8350335e0caaaeb0f	common_voice_ru_18928808.mp3	Колумбия приветствует заключительный доклад, но, как и другие, моя делегация не полностью удовлетворена результатом.	1	2	twenties	male		ru	
e8fa3f83083bdee9d15a7cbf06392bea487b14ab13bf3b8a018765a1519a03db3fe35f21ed6cbf025f96db936710f70abc7889dac6481aa8350335e0caaaeb0f	common_voice_ru_18928871.mp3	Харун умышленно искажал при переводе их жалобы, чтобы скрыть их содержание.	0	2	twenties	male		ru	
8213a0f79acb074bf5427027efa90e01391d8709700f103d434a0831e9232e7c83551fff5f5e2bf4e65128b0432eeec7292ecbfaa0c624ea2b3d38450e844c22	common_voice_ru_18928886.mp3	Нет никакого сомнения, что сирийские власти несут огромную долю ответственности за происходящее.	0	2	twenties	female		ru	
e8fa3f83083bdee9d15a7cbf06392bea487b14ab13bf3b8a018765a1519a03db3fe35f21ed6cbf025f96db936710f70abc7889dac6481aa8350335e0caaaeb0f	common_voice_ru_18928888.mp3	Сейчас я предоставляю слово представителю Ботсваны.	1	2	twenties	male		ru	
8213a0f79acb074bf5427027efa90e01391d8709700f103d434a0831e9232e7c83551fff5f5e2bf4e65128b0432eeec7292ecbfaa0c624ea2b3d38450e844c22	common_voice_ru_18928952.mp3	А есть прямой поезд из Кирова в Вологду?	0	2	twenties	female		ru	
8213a0f79acb074bf5427027efa90e01391d8709700f103d434a0831e9232e7c83551fff5f5e2bf4e65128b0432eeec7292ecbfaa0c624ea2b3d38450e844c22	common_voice_ru_18928957.mp3	Под свист, шум и улюлюканье, спрятав голову в плечи, Квакин медленно пошел прочь.	0	2	twenties	female		ru	
8213a0f79acb074bf5427027efa90e01391d8709700f103d434a0831e9232e7c83551fff5f5e2bf4e65128b0432eeec7292ecbfaa0c624ea2b3d38450e844c22	common_voice_ru_18928970.mp3	Это перекликается со словами президента Сальвы Киира, выступившего вчера с аналогичным заявлением.	1	2	twenties	female		ru	
e8fa3f83083bdee9d15a7cbf06392bea487b14ab13bf3b8a018765a1519a03db3fe35f21ed6cbf025f96db936710f70abc7889dac6481aa8350335e0caaaeb0f	common_voice_ru_18928987.mp3	Финансовые доклады и проверенные финансовые ведомости и доклады Комиссии ревизоров.	1	2	twenties	male		ru	
e8fa3f83083bdee9d15a7cbf06392bea487b14ab13bf3b8a018765a1519a03db3fe35f21ed6cbf025f96db936710f70abc7889dac6481aa8350335e0caaaeb0f	common_voice_ru_18928990.mp3	По отдельности государства региона прилагают энергичные усилия к исправлению сложившейся ситуации.	0	2	twenties	male		ru	
8213a0f79acb074bf5427027efa90e01391d8709700f103d434a0831e9232e7c83551fff5f5e2bf4e65128b0432eeec7292ecbfaa0c624ea2b3d38450e844c22	common_voice_ru_18929009.mp3	Тридцать пять миллиардов семьсот восемьдесят шесть миллионов девятьсот двадцать девять тысяч сто двенадцать.	1	2	twenties	female		ru	
8213a0f79acb074bf5427027efa90e01391d8709700f103d434a0831e9232e7c83551fff5f5e2bf4e65128b0432eeec7292ecbfaa0c624ea2b3d38450e844c22	common_voice_ru_18929043.mp3	Завершение переходного периода в августе нынешнего года будет означать окончание более чем двадцатилетнего конфликта.	1	2	twenties	female		ru	
